{
  "schema": "com.rhythmkit.chart.v1",
  "generator_version": "0.3.0",
  "song_id": "ready_expert_demo",
  "title": "Ready Expert Demo",
  "artist": "April Showers (1922 vocal recording)",
  "audio": "../audio/song.wav",
  "duration": 184.1644,
  "bpm": 136.0,
  "offset": 0.0,
  "theme": "cooking",
  "difficulty": {
    "name": "expert",
    "rating": 9,
    "lanes": 3,
    "notes_per_30s": 175,
    "min_gap": 0.11,
    "note_speed": 780,
    "perfect_window": 0.035,
    "good_window": 0.07,
    "allow_doubles": true,
    "allow_holds": true,
    "dynamic_density": 0.9,
    "section_seconds": 4.0,
    "double_rate": 0.26,
    "hold_rate": 0.22,
    "hold_min": 0.3,
    "hold_max": 1.2
  },
  "lanes": [
    {
      "id": 0,
      "name": "CUT",
      "default_key": "A"
    },
    {
      "id": 1,
      "name": "STIR",
      "default_key": "S"
    },
    {
      "id": 2,
      "name": "FIRE",
      "default_key": "D"
    }
  ],
  "notes": [
    {
      "id": 1,
      "time": 1.0449,
      "lane": 2,
      "type": "hold",
      "source": "sustain_hold",
      "confidence": 0.2346,
      "duration": 0.3776,
      "centroid_hz": 3217.7
    },
    {
      "id": 2,
      "time": 1.5325,
      "lane": 0,
      "type": "hold",
      "source": "sustain_hold",
      "confidence": 0.2604,
      "duration": 0.7492,
      "centroid_hz": 3614.8
    },
    {
      "id": 3,
      "time": 2.3917,
      "lane": 1,
      "type": "hold",
      "source": "sustain_hold",
      "confidence": 0.2343,
      "duration": 0.3544,
      "centroid_hz": 3429.9
    },
    {
      "id": 4,
      "time": 2.8561,
      "lane": 0,
      "type": "hold",
      "source": "sustain_hold",
      "confidence": 0.2708,
      "duration": 0.3311,
      "centroid_hz": 3025.9
    },
    {
      "id": 5,
      "time": 2.8561,
      "lane": 2,
      "type": "tap",
      "source": "accent_double",
      "confidence": 0.2708,
      "centroid_hz": 3025.9
    },
    {
      "id": 6,
      "time": 3.2972,
      "lane": 0,
      "type": "tap",
      "source": "onset",
      "confidence": 0.2432,
      "centroid_hz": 2307.5
    },
    {
      "id": 7,
      "time": 3.4133,
      "lane": 1,
      "type": "tap",
      "source": "onset",
      "confidence": 0.2831,
      "centroid_hz": 2254.8
    },
    {
      "id": 8,
      "time": 3.7152,
      "lane": 1,
      "type": "tap",
      "source": "onset",
      "confidence": 0.3151,
      "centroid_hz": 3020.9
    },
    {
      "id": 9,
      "time": 4.0867,
      "lane": 0,
      "type": "hold",
      "source": "sustain_hold",
      "confidence": 0.3002,
      "duration": 0.3776,
      "centroid_hz": 3616.9
    },
    {
      "id": 10,
      "time": 4.0867,
      "lane": 2,
      "type": "tap",
      "source": "accent_double",
      "confidence": 0.3002,
      "centroid_hz": 3616.9
    },
    {
      "id": 11,
      "time": 4.5743,
      "lane": 2,
      "type": "hold",
      "source": "sustain_hold",
      "confidence": 0.282,
      "duration": 0.3544,
      "centroid_hz": 4017.1
    },
    {
      "id": 12,
      "time": 5.0387,
      "lane": 0,
      "type": "hold",
      "source": "sustain_hold",
      "confidence": 0.2513,
      "duration": 0.308,
      "centroid_hz": 2712.7
    },
    {
      "id": 13,
      "time": 5.4567,
      "lane": 1,
      "type": "hold",
      "source": "sustain_hold",
      "confidence": 0.2824,
      "duration": 0.7956,
      "centroid_hz": 3622.1
    },
    {
      "id": 14,
      "time": 6.3623,
      "lane": 0,
      "type": "tap",
      "source": "accent_double",
      "confidence": 0.2373,
      "centroid_hz": 2410.4
    },
    {
      "id": 15,
      "time": 6.3623,
      "lane": 1,
      "type": "hold",
      "source": "sustain_hold",
      "confidence": 0.2373,
      "duration": 1.2,
      "centroid_hz": 2410.4
    },
    {
      "id": 16,
      "time": 9.9614,
      "lane": 2,
      "type": "tap",
      "source": "onset",
      "confidence": 0.3655,
      "centroid_hz": 3020.5
    },
    {
      "id": 17,
      "time": 10.1471,
      "lane": 0,
      "type": "tap",
      "source": "onset",
      "confidence": 0.4781,
      "centroid_hz": 3572.2
    },
    {
      "id": 18,
      "time": 10.2864,
      "lane": 1,
      "type": "tap",
      "source": "onset",
      "confidence": 0.2992,
      "centroid_hz": 3677.0
    },
    {
      "id": 19,
      "time": 10.6115,
      "lane": 0,
      "type": "hold",
      "source": "sustain_hold",
      "confidence": 0.2369,
      "duration": 0.3776,
      "centroid_hz": 3793.5
    },
    {
      "id": 20,
      "time": 10.6115,
      "lane": 2,
      "type": "tap",
      "source": "accent_double",
      "confidence": 0.2369,
      "centroid_hz": 3793.5
    },
    {
      "id": 21,
      "time": 11.0991,
      "lane": 0,
      "type": "tap",
      "source": "onset",
      "confidence": 0.4791,
      "centroid_hz": 2440.8
    },
    {
      "id": 22,
      "time": 11.4939,
      "lane": 0,
      "type": "tap",
      "source": "onset",
      "confidence": 0.2979,
      "centroid_hz": 2760.4
    },
    {
      "id": 23,
      "time": 11.7493,
      "lane": 1,
      "type": "tap",
      "source": "onset",
      "confidence": 0.3592,
      "centroid_hz": 3956.1
    },
    {
      "id": 24,
      "time": 11.8886,
      "lane": 0,
      "type": "tap",
      "source": "accent_double",
      "confidence": 0.4196,
      "centroid_hz": 2380.6
    },
    {
      "id": 25,
      "time": 11.8886,
      "lane": 1,
      "type": "tap",
      "source": "onset",
      "confidence": 0.4196,
      "centroid_hz": 2380.6
    },
    {
      "id": 26,
      "time": 12.0047,
      "lane": 0,
      "type": "tap",
      "source": "onset",
      "confidence": 0.4218,
      "centroid_hz": 2269.3
    },
    {
      "id": 27,
      "time": 12.353,
      "lane": 1,
      "type": "tap",
      "source": "onset",
      "confidence": 0.3438,
      "centroid_hz": 2584.2
    },
    {
      "id": 28,
      "time": 12.6781,
      "lane": 2,
      "type": "tap",
      "source": "onset",
      "confidence": 0.3179,
      "centroid_hz": 2433.9
    },
    {
      "id": 29,
      "time": 12.9103,
      "lane": 0,
      "type": "tap",
      "source": "onset",
      "confidence": 0.2688,
      "centroid_hz": 2661.1
    },
    {
      "id": 30,
      "time": 12.9103,
      "lane": 2,
      "type": "tap",
      "source": "accent_double",
      "confidence": 0.2688,
      "centroid_hz": 2661.1
    },
    {
      "id": 31,
      "time": 13.2122,
      "lane": 2,
      "type": "hold",
      "source": "sustain_hold",
      "confidence": 0.3103,
      "duration": 0.3079,
      "centroid_hz": 3166.6
    },
    {
      "id": 32,
      "time": 13.6301,
      "lane": 1,
      "type": "tap",
      "source": "onset",
      "confidence": 0.336,
      "centroid_hz": 2513.8
    },
    {
      "id": 33,
      "time": 13.7462,
      "lane": 2,
      "type": "tap",
      "source": "onset",
      "confidence": 0.2675,
      "centroid_hz": 2350.7
    },
    {
      "id": 34,
      "time": 13.8623,
      "lane": 0,
      "type": "tap",
      "source": "accent_double",
      "confidence": 0.4002,
      "centroid_hz": 2342.8
    },
    {
      "id": 35,
      "time": 13.8623,
      "lane": 1,
      "type": "tap",
      "source": "onset",
      "confidence": 0.4002,
      "centroid_hz": 2342.8
    },
    {
      "id": 36,
      "time": 13.9784,
      "lane": 2,
      "type": "tap",
      "source": "onset",
      "confidence": 0.4727,
      "centroid_hz": 2795.5
    },
    {
      "id": 37,
      "time": 14.141,
      "lane": 1,
      "type": "tap",
      "source": "onset",
      "confidence": 0.437,
      "centroid_hz": 2357.1
    },
    {
      "id": 38,
      "time": 14.3964,
      "lane": 1,
      "type": "hold",
      "source": "sustain_hold",
      "confidence": 0.3207,
      "duration": 0.3544,
      "centroid_hz": 2633.8
    },
    {
      "id": 39,
      "time": 14.8608,
      "lane": 0,
      "type": "tap",
      "source": "onset",
      "confidence": 0.3295,
      "centroid_hz": 2834.6
    },
    {
      "id": 40,
      "time": 14.8608,
      "lane": 2,
      "type": "tap",
      "source": "accent_double",
      "confidence": 0.3295,
      "centroid_hz": 2834.6
    },
    {
      "id": 41,
      "time": 15.0001,
      "lane": 0,
      "type": "tap",
      "source": "onset",
      "confidence": 0.3898,
      "centroid_hz": 2451.1
    },
    {
      "id": 42,
      "time": 15.1626,
      "lane": 1,
      "type": "tap",
      "source": "onset",
      "confidence": 0.3039,
      "centroid_hz": 2426.6
    },
    {
      "id": 43,
      "time": 15.3252,
      "lane": 2,
      "type": "tap",
      "source": "onset",
      "confidence": 0.3647,
      "centroid_hz": 2389.8
    },
    {
      "id": 44,
      "time": 15.4877,
      "lane": 0,
      "type": "tap",
      "source": "accent_double",
      "confidence": 0.3819,
      "centroid_hz": 2592.9
    },
    {
      "id": 45,
      "time": 15.4877,
      "lane": 1,
      "type": "tap",
      "source": "onset",
      "confidence": 0.3819,
      "centroid_hz": 2592.9
    },
    {
      "id": 46,
      "time": 15.6502,
      "lane": 2,
      "type": "tap",
      "source": "onset",
      "confidence": 0.3783,
      "centroid_hz": 2686.6
    },
    {
      "id": 47,
      "time": 15.836,
      "lane": 1,
      "type": "tap",
      "source": "onset",
      "confidence": 0.3242,
      "centroid_hz": 2318.5
    },
    {
      "id": 48,
      "time": 15.9753,
      "lane": 2,
      "type": "tap",
      "source": "onset",
      "confidence": 0.3278,
      "centroid_hz": 2368.2
    },
    {
      "id": 49,
      "time": 16.1611,
      "lane": 0,
      "type": "tap",
      "source": "accent_double",
      "confidence": 0.3275,
      "centroid_hz": 2524.7
    },
    {
      "id": 50,
      "time": 16.1611,
      "lane": 1,
      "type": "hold",
      "source": "sustain_hold",
      "confidence": 0.3275,
      "duration": 0.9349,
      "centroid_hz": 2524.7
    },
    {